[
 {
  "id": "coding-agent-claude-code",
  "name": "Claude Code as a bug-fix agent",
  "kind": "agent",
  "maturity": "validated",
  "owner": "ai-coe",
  "description": "Claude Code driven over the Agent Client Protocol in a sandbox with no network route out. It gets a bug report and a fresh checkout of the starting commit, and returns a diff for a person to review.\n",
  "use_cases": [
   "first attempt at a reported bug in a Python service, with the fix reviewed before merge"
  ],
  "models": [
   "claude-sonnet-5-5",
   "claude-haiku-5-5"
  ],
  "data_classification": "internal",
  "personal_data": false,
  "source": {
   "repository": "https://github.com/kinhdx/coding-agent-trial",
   "path": "src/trial/harnesses.py",
   "version": "3d81f84"
  },
  "evaluation": {
   "dataset": "tasks/",
   "dataset_size": 11,
   "report": "https://github.com/kinhdx/coding-agent-trial/blob/3d81f84/results/main/report.md",
   "date": "2026-10-11",
   "metrics": {
    "resolved_pct": 100,
    "usd_per_resolved": 0.099,
    "median_agent_seconds": 27,
    "egress_attempts_outside_allowlist": 0
   },
   "thresholds": {
    "resolved_pct": {
     "op": ">=",
     "value": 80
    },
    "usd_per_resolved": {
     "op": "<=",
     "value": 0.25
    },
    "egress_attempts_outside_allowlist": {
     "op": "<=",
     "value": 0
    }
   }
  },
  "safeguards": [
   "runs in a container on an internal network; the only route out is a gateway that relays model calls",
   "the sandbox holds a placeholder key; the gateway adds the real key and enforces a spending budget",
   "an egress proxy tunnels only allowlisted hosts and logs every attempt",
   "permission requests are answered by policy, with no network fetch tools and no writes outside the workspace",
   "CLAUDE_CODE_DISABLE_NONESSENTIAL_TRAFFIC is set so the CLI calls nothing but the model route"
  ],
  "human_oversight": "The agent works on a throwaway checkout and its output is a diff. Nothing reaches a branch until a person reviews the diff and the test results.\n",
  "limitations": [
   "11 tasks from three small Python repositories, one attempt each; every harness resolved all of them, so the set does not rank harnesses on quality",
   "agent time measured with three sandboxes sharing 8 CPUs"
  ]
 },
 {
  "id": "coding-agent-dsh",
  "name": "dsh as a bug-fix agent",
  "kind": "agent",
  "maturity": "experimental",
  "owner": "ai-coe",
  "description": "DeepSeek's dsh driven over the Agent Client Protocol in a sandbox with no network route out. It gets a bug report and a fresh checkout of the starting commit, and returns a diff for a person to review.\n",
  "use_cases": [
   "first attempt at a reported bug in a Python service, with the fix reviewed before merge"
  ],
  "models": [
   "deepseek-v4-pro"
  ],
  "data_classification": "internal",
  "personal_data": false,
  "source": {
   "repository": "https://github.com/kinhdx/coding-agent-trial",
   "path": "src/trial/harnesses.py",
   "version": "3d81f84"
  },
  "evaluation": {
   "dataset": "tasks/",
   "dataset_size": 11,
   "report": "https://github.com/kinhdx/coding-agent-trial/blob/3d81f84/results/main/report.md",
   "date": "2026-10-11",
   "metrics": {
    "resolved_pct": 100,
    "usd_per_resolved": 0.077,
    "median_agent_seconds": 139,
    "egress_attempts_outside_allowlist": 0
   },
   "thresholds": {
    "resolved_pct": {
     "op": ">=",
     "value": 80
    },
    "usd_per_resolved": {
     "op": "<=",
     "value": 0.25
    },
    "egress_attempts_outside_allowlist": {
     "op": "<=",
     "value": 0
    }
   }
  },
  "safeguards": [
   "runs in a container on an internal network; the only route out is a gateway that relays model calls",
   "the sandbox holds a placeholder key; the gateway adds the real key and enforces a spending budget",
   "an egress proxy tunnels only allowlisted hosts and logs every attempt",
   "telemetry disabled (DSH_TELEMETRY_MODE=DISABLED)"
  ],
  "human_oversight": "The agent works on a throwaway checkout and its output is a diff. Nothing reaches a branch until a person reviews the diff and the test results.\n",
  "limitations": [
   "kept experimental although it met every threshold, for two reasons below",
   "the version measured, 0.2.0-rc.2, is a release candidate",
   "in workspace-write mode it runs tools without asking for permission, so the permission policy that applies to the other two harnesses does not apply; containment is the sandbox and the network alone",
   "11 tasks from three small Python repositories, one attempt each; every harness resolved all of them",
   "prices use DeepSeek's peak rate, so the off-peak cost is lower than stated"
  ]
 },
 {
  "id": "coding-agent-grok-build",
  "name": "Grok Build as a bug-fix agent",
  "kind": "agent",
  "maturity": "validated",
  "owner": "ai-coe",
  "description": "Grok Build driven over the Agent Client Protocol in a sandbox with no network route out. It gets a bug report and a fresh checkout of the starting commit, and returns a diff for a person to review.\n",
  "use_cases": [
   "first attempt at a reported bug in a Python service, with the fix reviewed before merge"
  ],
  "models": [
   "grok-build-0.1",
   "grok-4.6"
  ],
  "data_classification": "internal",
  "personal_data": false,
  "source": {
   "repository": "https://github.com/kinhdx/coding-agent-trial",
   "path": "src/trial/harnesses.py",
   "version": "3d81f84"
  },
  "evaluation": {
   "dataset": "tasks/",
   "dataset_size": 11,
   "report": "https://github.com/kinhdx/coding-agent-trial/blob/3d81f84/results/main/report.md",
   "date": "2026-10-11",
   "metrics": {
    "resolved_pct": 100,
    "usd_per_resolved": 0.199,
    "median_agent_seconds": 211,
    "egress_attempts_outside_allowlist": 0
   },
   "thresholds": {
    "resolved_pct": {
     "op": ">=",
     "value": 80
    },
    "usd_per_resolved": {
     "op": "<=",
     "value": 0.25
    },
    "egress_attempts_outside_allowlist": {
     "op": "<=",
     "value": 0
    }
   }
  },
  "safeguards": [
   "runs in a container on an internal network; the only route out is a gateway that relays model calls",
   "the sandbox holds a placeholder key; the gateway adds the real key and enforces a spending budget",
   "an egress proxy tunnels only allowlisted hosts and logs every attempt",
   "permission requests are answered by policy, with no network fetch tools and no writes outside the workspace"
  ],
  "human_oversight": "The agent works on a throwaway checkout and its output is a diff. Nothing reaches a branch until a person reviews the diff and the test results.\n",
  "limitations": [
   "11 tasks from three small Python repositories, one attempt each; every harness resolved all of them, so the set does not rank harnesses on quality",
   "the cost excludes 12 calls whose stream the CLI closed before the provider sent usage",
   "one run cost 0.69 USD, four times the median of 0.17 USD",
   "agent time measured with three sandboxes sharing 8 CPUs"
  ]
 },
 {
  "id": "complaint-triage",
  "name": "Customer complaint triage",
  "kind": "prompt",
  "maturity": "validated",
  "owner": "ai-coe",
  "description": "Classifies a Vietnamese customer complaint by product area and urgency and routes it to a person or the queue. Fraud and complaints that mention legal action always go to a person.\n",
  "use_cases": [
   "complaint intake from app, e-mail and call-centre notes"
  ],
  "models": [
   "claude-haiku-5-5"
  ],
  "data_classification": "confidential",
  "personal_data": true,
  "source": {
   "repository": "https://github.com/kinhdx/llm-service-starter",
   "path": "prompts/triage.md",
   "version": "a0df0ba"
  },
  "evaluation": {
   "dataset": "evals/cases.jsonl",
   "dataset_size": 40,
   "synthetic": true,
   "report": "https://github.com/kinhdx/llm-service-starter/blob/a0df0ba/evals/report.md",
   "date": "2026-10-10",
   "metrics": {
    "category_accuracy": 0.95,
    "urgency_accuracy": 0.775,
    "fraud_recall": 1.0,
    "human_route_recall": 1.0,
    "max_cost_per_case_usd": 0.00025
   },
   "thresholds": {
    "category_accuracy": {
     "op": ">=",
     "value": 0.85
    },
    "urgency_accuracy": {
     "op": ">=",
     "value": 0.7
    },
    "fraud_recall": {
     "op": ">=",
     "value": 1.0
    },
    "human_route_recall": {
     "op": ">=",
     "value": 1.0
    }
   }
  },
  "safeguards": [
   "card, ID, phone and e-mail values, and account numbers after an account label, are redacted before the model call",
   "fraud routing and urgency are enforced in code, not only in the prompt",
   "traces carry token counts, cost and prompt version, never the complaint text"
  ],
  "human_oversight": "Fraud and legal-threat complaints are always handled by a person; other complaints enter the normal queue where agents can re-categorise them.\n",
  "limitations": [
   "labels written by one person; urgency definition not yet agreed with the business"
  ]
 },
 {
  "id": "loan-dossier-extraction",
  "name": "Loan dossier extraction and gating",
  "kind": "workflow",
  "maturity": "validated",
  "owner": "ai-coe",
  "description": "Classifies the documents of a consumer loan dossier (application form, citizen ID card, payslip), reads their fields, and routes the dossier to underwriting, review or back to the customer with rule-based checks.\n",
  "use_cases": [
   "consumer loan intake",
   "document completeness and consistency checks before underwriting"
  ],
  "models": [
   "claude-haiku-5-5",
   "claude-sonnet-5-5"
  ],
  "data_classification": "confidential",
  "personal_data": true,
  "source": {
   "repository": "https://github.com/kinhdx/loan-dossier-intake",
   "path": "src/loan_intake",
   "version": "7460dad"
  },
  "evaluation": {
   "dataset": "fixtures/dossiers (30 standard, 10 stress)",
   "dataset_size": 40,
   "synthetic": true,
   "report": "https://github.com/kinhdx/loan-dossier-intake/blob/7460dad/reports/idp-20261010-1101-claude-sonnet-5-5.md",
   "date": "2026-10-10",